"Bulacan, Philippines",Philippines,Male,College degree,Coursera,"IT, BPO, and Business Services",Government, ,"Ipil, Philippines","35,001 to 45,000",Other - specify, _,Data Analyst,Data Scientist,30+,,,,,Looker,Mixpanel,"Don't know, None",AWS Glue Data Catalog,"Amazon Web Services (AWS), Microsoft Azure, Snowflake, Databricks",,"Google sheets, Excel, Google Drive, Google Meet","DAX (Power BI), Python, SQL","Chatgpt, Copilot",Colab Notebooks,laptop,"Yes, I am aware of the free resources in the DEP website.","Yes, I have used at least one resource.","Analytics Association of the Philippines, Data Science Philippines","Career advancement, Continued learning, Upskill / Skill acquisition",_,not applicable,My network  - people I know,Local employer,24
Antipolo,Philippines,Male,College degree,"Udemy, W3Schools","IT, BPO, and Business Services",Career shifter,Work city same as residence,Pasay,"45,001 to 55, 000",Full-time,Hybrid,Data Analyst,Data Analyst,6 to 10,Fivetran,Pandas,Databricks,Don't know,Power BI,"None, ",dbt,Open Metadata,,,"Excel, Google Drive, OneDrive, MS Teams, MS planner","SQL, C++",Chatgpt,not applicable,laptop,"No, I just found out now.",NONE,Project SPARTA,"Career advancement, Continued learning, Decision to shift, Upskill / Skill acquisition","Answer surveys, Joint initiative with other groups, Regularly post content",-,My network  - people I know,none,31
"Makati, Philippines",Philippines,Male,Other - specify,"Datacamp, W3Schools",Education,Not a data role. But uses data engineering in work. ,Work city different from residence,Quezon City,"65,001 to 75,000",Full-time,100% onsite,Software Engineer,"Management, Software Engineer, Machine Learning Engineer, AI Engineer, Developer, UI/UX Designer",6 to 10,,,Big Query,Airflow,.,,,,,MS SQL Server,"Google sheets, Excel, Google Drive, OneDrive, Zoom, MS Teams, Google Meet",R,"Chatgpt, Copilot",-,desktop,"Yes, I am aware of the free resources in the DEP website.","Yes, I have used at least one resource.","Analytics Association of the Philippines, Datasense Philippines","Continued learning, Hobbies and Interest",Answer surveys,,My network  - people I know,Unemployed,23
"Quezon City, Philippines",Philippines,Male,College degree,"Cisco, Coursera, Datacamp",Not working,Career shifter,.,Still no work but I would prefer either Hybrid or Remote Setup,"95,001 to 100,000",Freelance,Mostly work from home/ fully remote,Data Encoder,Data Entry Job,4 to 5,Don't know,Don't know,Don't know,Don't know,Don't know,Don't know,Don't know,,,Microsoft SQL Server,"Google sheets, Excel, Google Drive, OneDrive, Zoom, Google Meet, Slack, Discord","DAX (Power BI), M language (Power Query), SQL","Chatgpt, Copilot, Gemini, Datalab",I am not using any of the above mentioned notebook products,desktop,"Yes, I am aware of the free resources in the DEP website.","Yes, I have used at least one resource.","Data Analytics Philippines, Datasense Philippines, Power BI Users Meetup, R User Group - Philippines","Continued learning, Upskill / Skill acquisition, Network","Answer surveys, Regularly post content, Volunteer for group initiatives",,I am still yet to try these job networking sites.,_,24
"La pinas, Philippines",Philippines,Prefer not to say,College degree,"LinkedIn Learning, Youtube bootcamp",Banking / Finance / Insurance,Professional,Work city different from residence,Makati,"25,001 to 35,000",Full-time,Mostly work from home/ fully remote,Data Analyst,Data Engineer,30+,Don't know,Don't know,Databricks,Don't know,,Don't know,Don't know,Don't know,,"MongoDB, PostgreSQL","Google sheets, Excel, Google Drive, OneDrive, Zoom, MS Teams, Google Meet","DAX (Power BI), M language (Power Query)","Chatgpt, Liner","Colab Notebooks, Azure Notebooks",laptop,"No, I just found out now.","No, I just browsed through.","AI Pilipinas, AIM-Master of Science in Data Science, Analytics Association of the Philippines, Community: SPARTA PH, Data and Analytics Manila, Data Science Manila, Data Science Philippines, Data Science Philippines Discussion Group (Moderated), FTW Foundation, Manila Women in Machine Learning and Data Science, MS in Data Science - AIM Group, Philippine Data Scientists Community - eScience, PyData Philippines, She Loves Data Group, SPARTA PH: Data Engineer, Women Who Code Manila","Career advancement, Continued learning, Upskill / Skill acquisition","Answer surveys, Regularly post content",Always share what you succesfully achieved so that other people will be inspire to try it. ,"LinkedIn, Indeed",Multinational employer,27
"Paranaque, Philippines",Philippines,Male,,"Not currently using any digital tools for learning, W3Schools, Youtube bootcamp",,Professional,Work city different from residence,,"15,000 and below",Full-time,. ,,,1 - Just me,,,,,,,,,"Google Cloud Platform (GCP), Databricks",,"Google sheets, Excel, Google Drive","Python, SQL","Chatgpt, Copilot, Gemini, Perplexity", ,laptop,"Yes, I am aware of the free resources in the DEP website.","No, I just browsed through.",Java User Group Philippines,"Decision to shift, Upskill / Skill acquisition, Network","Answer surveys, Joint initiative with other groups, Regularly post content, Co-training/ Training",I think the group have everything they have specially on reminding their members on everything.,My network  - people I know,not applicable,22
Antipolo,Philippines,LGBTQ+,College degree,"Cisco, Coursera, Datacamp, Google Developers",Tourism,Career shifter,none,Pasay,"c.250,001 and above",Full-time,100% onsite,Data Engineer,"Management, Data Engineer, Data Analyst",2 to 3,-, _,Databricks,,Power BI,"Don't know, None",,Datahub,"Don't know, None","Don't know, None","Excel, Google Drive, OneDrive, MS Teams, MS planner","Javascript, Python, SQL","No, I do not use AI currently",,laptop,"Yes, I am aware of the free resources in the DEP website.","No, I just browsed through.",Project SPARTA,"Career advancement, Upskill / Skill acquisition",Answer surveys,. ,Facebook,Local employer,24
"Sta. Rosa, Laguna",Philippines,Male,Secondary school student,Coursera,Construction,Freelance,Work city different from residence,Remote.,,Freelance,Mostly work from home/ fully remote,Academic,Academic,4 to 5,None,.,none, ,Power BI,,Don't know,Don't know,Google Cloud Platform (GCP),"Oracle Database, IBM Db2","Google sheets, Excel, Dropbox, Google Drive, OneDrive, Zoom, MS Teams, Google Meet, Discord","Python, SQL","No, I do not use AI currently",not applicable,laptop,"Yes, I am aware of the free resources in the DEP website.","Yes, I have used at least one resource.","Java User Group Philippines, Power BI Philippines UG","Career advancement, Continued learning, Upskill / Skill acquisition","Answer surveys, Regularly post content",Initiate an frequent event or mini games.,Indeed,Multinational employer,28
"Laguna, Philippines",Philippines,Male,College degree,Youtube bootcamp,"IT, BPO, and Business Services",Career shifter,Work city same as residence,Cebu City,"55,001 to 65,000",Full-time,100% onsite,Manufacturing Engineer,Data Analyst,4 to 5,/,"Pandas, Spark",Don't know,NONE,Looker,. ,None,None,.,.,"Excel, OneDrive, MS Teams","Python, SQL",Chatgpt,,laptop,"No, I just found out now.","No, I just browsed through.",,"Career advancement, Continued learning, Upskill / Skill acquisition, Network","Answer surveys, Resource for specific topic",NONE,"LinkedIn, My network  - people I know",Multinational employer,25
"Lucena, City",Philippines,Male,Secondary school student,Datacamp,"IT, BPO, and Business Services",Professional,Work city different from residence,Pasay,,Full-time,100% onsite,Data Engineer,Data Engineer,11 to 30,Don't know,Pandas,"Snowflake, Dataverse","Don't know, None",Power BI,,.,,,"Don't know, None","Google sheets, Excel, Google Drive, OneDrive, MS Teams","Javascript, Python, SQL, C","Chatgpt, Gemini",_,laptop,"Yes, I am aware of the free resources in the DEP website.","Yes, I have used at least one resource.",,"Career advancement, Upskill / Skill acquisition, Network","Answer surveys, Co-training/ Training, Volunteer for group initiatives",NONE,Indeed,Local employer,23
"Sta. Rosa, Laguna",Philippines,Female,,"Coursera, edX, IBM Skills Gateway, Udemy, W3Schools, WorldQuandt University",Not working,Student/ New grad/ Career Break,Work city same as residence,none,, _,_,.,na,2 to 3,.,na,-,NONE, ,not applicable, _,none,NONE,na,"Google sheets, Excel, Dropbox, Google Drive, OneDrive, Zoom, MS Teams, Google Meet, Discord","DAX (Power BI), M language (Power Query), Python, R, SQL, VBA","Chatgpt, Claude, Copilot",na,laptop,"No, I just found out now.","No, I just browsed through.","DevOps Philippines, DEVCON Community Group, DEVCON Philippines","Career advancement, Continued learning","Answer surveys, Mentor, Co-training/ Training, Volunteer for group initiatives",More invites,-,Multinational employer,33
"Taguig, Philippines",Philippines,LGBTQ+,Master's degree,"Codecademy, Datacamp, edX, Freecodecamp, Git Hub Learning Lab, Google Cloudskills Boost, Google Developers, LinkedIn Learning, MicrosoftLearn, Real Python, W3Schools","IT, BPO, and Business Services",Student/ New grad/ Career Break,na,none,,-,not applicable,not applicable, ,not applicable, ,. ,-,None,na,None,. ,.,none,NONE,"Google sheets, Excel, Dropbox, Google Drive, OneDrive, Trello, Zoom, MS Teams, Google Meet, Slack, Discord","Appscript (Google), Python, SQL",Chatgpt, _,laptop,"No, I just found out now.","Yes, I have used at least one resource.",.,"Continued learning, Network, Help others, share knowledge","Answer surveys, Coordinate during events, Joint initiative with other groups, Mentor, Regularly post content, Co-training/ Training, Volunteer for group initiatives",More hackathons and learning sessions; projects to collaborate with,/,Local employer,47
"Manila, Philippines",Philippines,Male,Secondary school student,"Coursera, Datacamp, Google Analytics, HackerRank",Not working,Student/ New grad/ Career Break,not applicable,-,,_, ,., ,none,NONE,na, ,none,NONE, _, _,NONE,na,None,"Google sheets, Excel, Google Drive, OneDrive, Trello, MS Teams, Google Meet, Slack, Discord","Javascript, SQL","Chatgpt, Claude, Copilot, Gemini",. ,laptop,"Yes, I am aware of the free resources in the DEP website.","No, I just browsed through.",.,Career advancement,Answer surveys,_,None,.,21
"Bicol, Philippines",Philippines,Male,College degree,"Coursera, Datacamp",Education,Student/ New grad/ Career Break,/,NONE,,/,. ,. ,.,None,None,_, ,not applicable,none,/, _, _,none,-,"Google sheets, Excel, Google Drive, Zoom, MS Teams, Google Meet, Discord, Notion","Python, SQL","Chatgpt, Copilot", _,laptop,"Yes, I am aware of the free resources in the DEP website.","Yes, I have used at least one resource.",Datasense Philippines,/,"Answer surveys, Coordinate during events, Volunteer for group initiatives",_,. ,Local employer,31
"Cairo, Egypt",Egypt,Male,Master's degree,"Codecademy, Coursera",Energy,Freelance, ,Cairo,"25,001 to 35,000",Full-time,Hybrid,Academic,Developer,2 to 3,,Dataform,,,na, _,not applicable, ,None,,"Google sheets, Excel, Dropbox, Google Drive, OneDrive","Python, R","Claude, Gemini",PythonAnywhere Jupyter Notebook,laptop,"No, I just found out now.","No, I just browsed through.","[Manila] BIG DATA Tech Group, Analytics Association of the Philippines, Data Analytics Philippines, Data and Analytics Manila, Data Science Manila, Data Science Philippines, DEVCON Community Group, Eskwelabs Data Science Aral-Aral Group, Project SPARTA, Python Philippines","Career advancement, Decision to shift","Connect with sponsors, Mentor",No,"LinkedIn, Fiverr",Academe,41
"Lucena City, Quezon Province",Philippines,Male,College degree,"Coursera, Datacamp",Not working,Career shifter,Work city different from residence,Unemployed,"15,000 and below",Other - specify,Unemployed,Unemployed,Unemployed,1 - Just me,not applicable,. ,not applicable,None,NONE,ACL,Great Expectations,,Amazon Web Services (AWS),na,"Google sheets, Excel, Google Drive, Zoom, Google Meet, Discord","Javascript, Python, R",Chatgpt,PythonAnywhere Jupyter Notebook,laptop,"No, I just found out now.", ,"Analytics Association of the Philippines, Big Data Analytics PH, Community: SPARTA PH, Data Analytics Philippines, Datasense Philippines, DevOps Philippines, Eskwelabs Data Science Aral-Aral Group, Project SPARTA","Career advancement, Continued learning, Upskill / Skill acquisition",Answer surveys,"Organize post by adding tags for Job post, learnings, etc.",LinkedIn,_,32
Baliwag City,Philippines,Female,College degree,"Cisco, Datacamp, Kaggle Online course, W3Schools",Construction,Student/ New grad/ Career Break,/,not applicable,,., ,/,_,none,NONE,na,None,.,NONE,_,not applicable,na,-, ,"Google sheets, Excel, Google Drive, OneDrive, Zoom, MS Teams, Google Meet, Discord","Python, SQL","Chatgpt, Claude","Colab Notebooks, PythonAnywhere Jupyter Notebook",laptop,"Yes, I am aware of the free resources in the DEP website.","No, I just browsed through.","Analytics Association of the Philippines, Data Analytics Philippines, Data and Analytics Manila, DEVCON Community Group, DEVCON Philippines, Java User Group Philippines, Python Philippines, WiTech",na,Answer surveys,.,na,/,22
"Taguig, Philippines",Philippines,LGBTQ+,Other - specify,"Coursera, IBM Skills Gateway, Oracle University","IT, BPO, and Business Services",Student/ New grad/ Career Break, _,None,, _, _,not applicable, _, _,-,. ,,"Don't know, dbt cloud? ",na,None,None,not applicable,-,_,"Google sheets, Excel, Dropbox, Google Drive, OneDrive, Zoom, MS Teams, Google Meet, Discord", _,Copilot,IBM Watson Studio,desktop,"Yes, I am aware of the free resources in the DEP website.","No, I just browsed through.","DataScience.PH, Power BI Philippines UG","Career advancement, Decision to shift, Upskill / Skill acquisition","Answer surveys, Joint initiative with other groups, Volunteer for group initiatives",none as of the moment,-,Multinational employer,32
"Taguig, Philippines",Philippines,Male,College degree,Udemy,Healthcare,Professional,Work city different from residence,Melbourne,"75,001 to 85,000",Full-time,Mostly work from home/ fully remote,Reports,Reports,4 to 5, ,not applicable, , ,Power BI,na, _,., _,NONE,"Excel, Dropbox, Google Drive, OneDrive, Zoom, MS Teams",Appscript (Google),Chatgpt,"Colab Notebooks, PythonAnywhere Jupyter Notebook",laptop,"Yes, I am aware of the free resources in the DEP website.","Yes, I have used at least one resource.","Data Analytics Philippines, Power BI Philippines UG","Career advancement, Continued learning, Decision to shift, Upskill / Skill acquisition, Network","Answer surveys, Coordinate during events, Volunteer for group initiatives","Keep going, you are doing wonderful!",LinkedIn,none,45
"Mandaluyong, Philippines",Philippines,Male,College degree,Datacamp,Tourism,Professional,Work city same as residence,Quezon City,"55,001 to 65,000",Full-time,Hybrid,Production Support and Developer,"Developer, Production Support",1 - Just me,,"Pandas, dbt",,,"Apache Superset, Looker, Power BI, Tableau",,dbt,dbt,"Amazon Web Services (AWS), Google Cloud Platform (GCP)",Oracle Database,"Excel, Google Drive, OneDrive, Trello, MS Teams, Discord",.,Chatgpt,na,desktop,"No, I just found out now.","No, I just browsed through.","AI Pilipinas, AIM-Master of Science in Data Science, Data Analytics Philippines, Data Ethics PH, Data Science Philippines Discussion Group (Moderated), DataSpark - Manila Meetups, DevOps Philippines, Digital Analytics Philippines, Eskwelabs Data Science Aral-Aral Group, Power Apps Pilipinas Community, Power BI Philippines UG, Project SPARTA, PyData Philippines, Python Philippines, Women Who Code Manila","Career advancement, Continued learning, Upskill / Skill acquisition, Network","Answer surveys, Joint initiative with other groups, Volunteer for group initiatives",None for now,Udemy,Local employer,45
"San Jose del Monte, Philippines",Philippines,LGBTQ+,Other - specify,"AWS Cloud Certification, Datacamp, W3Schools",Government research agency,Career shifter,Work city same as residence,Pasig City,"15,000 and below",Full-time,100% onsite,Data Analyst,Data Analyst,1 - Just me,Don't know,Don't know,Don't know,Don't know,Power BI,,Don't know,Don't know,,"Elasticsearch, Oracle Database","Google sheets, Excel, Monday.com, MS Teams","Python, SQL","Chatgpt, Copilot, Gemini, Julius","PythonAnywhere Jupyter Notebook, Visual Code",laptop,"No, I just found out now.","Yes, I have used at least one resource.","Analytics Association of the Philippines, Community: SPARTA PH, Data Analytics Philippines, Data Science Manila, Datasense Philippines, Power Apps Pilipinas Community, Power BI Philippines UG, Power BI Users Meetup, PyData Philippines, Python Philippines, R User Group - Philippines",Just curious ,Answer surveys,,"LinkedIn, Jobstreet", ,21
"Quezon City, Philippines",Philippines,LGBTQ+,Master's degree,"Coursera, Datacamp, edX, Freecodecamp, Kaggle Online course, LeetCode, W3Schools, Youtube bootcamp",Telecommunication,Career shifter,Work city same as residence,N.A,"a.100,001 to 125,000",Internship,Mostly work from home/ fully remote,N.A,N.A,2 to 3,"Don't know, Not needed in my current role",N.A,N.A,Dolphin Scheduler,N.A,Power Query,Stata and Pentaho Data Integration,,,N.A, ,not applicable,NONE,"Kaggle Notebooks, Colab Notebooks",laptop,"Yes, I am aware of the free resources in the DEP website.","Yes, I have used at least one resource.",. ,"Career advancement, Upskill / Skill acquisition",Answer surveys,.,"LinkedIn, Indeed",Local employer,23
Baguio City,Philippines,Male,College degree,"AWS Cloud Certification, Coursera, Freecodecamp, Google Cloudskills Boost, IBM Skills Gateway, Kaggle Online course, Khan Academy, LeetCode, LinkedIn Learning, MicrosoftLearn, Udemy, W3Schools, Youtube bootcamp, Zoomcamp",Accounting,Student/ New grad/ Career Break, , _,,none,none,NONE,not applicable,/, ,. ,/,none,None, , ,na,none,not applicable,"Google sheets, Excel, Dropbox, Google Drive, OneDrive, Zoom, MS Teams, Google Meet, Slack, Discord","Python, R, SQL","Chatgpt, Claude, Copilot, Gemini, Github copilot","Kaggle Notebooks, Colab Notebooks, IBM Watson Studio",laptop,"Yes, I am aware of the free resources in the DEP website.","No, I just browsed through.","DEVCON Community Group, DEVCON Philippines","Career advancement, Continued learning, Upskill / Skill acquisition, Network","Answer surveys, Coordinate during events, Joint initiative with other groups, Lead a study group, Resource for specific topic, Co-training/ Training",. ,-,/,23
"Bukit Batok, Singapore",Singapore,LGBTQ+,College degree,"Kaggle Online course, Udemy",Education,Student/ New grad/ Career Break,NONE,-,,na,_, _,none,NONE,. ,na, _,. ,-,., _,_, _,none,"Google sheets, Excel, Dropbox, Google Drive, OneDrive, Clickup, Zoom, MS Teams, Google Meet, Slack, Discord",Python,"Chatgpt, Copilot",PythonAnywhere Jupyter Notebook,laptop,"Yes, I am aware of the free resources in the DEP website.","No, I just browsed through.","Data Analytics Philippines, Data Science Philippines, Data Science Philippines Discussion Group (Moderated), Datasense Philippines, Programmers,Developers, Python Philippines","Continued learning, Upskill / Skill acquisition, Network","Joint initiative with other groups, Mentor, Co-training/ Training, Volunteer for group initiatives, Volunteer to speak in events",I am not sure but having regular online events might boost the engagement and participation of the members on all existing communication channels that the group has., ,Multinational employer,23
"Manila, Philippines",Philippines,Female,College degree,"Coursera, Freecodecamp, HackerRank, Kaggle Online course, LeetCode, W3Schools",Not working,Student/ New grad/ Career Break,not applicable, ,,None,na,-,-,not applicable, _,not applicable,not applicable,-, _,none,., _, _,. ,"Google sheets, Excel, Google Drive, Zoom, MS Teams, Google Meet, Slack, Discord","DAX (Power BI), Javascript, M language (Power Query), Python, SQL, Tableau","Chatgpt, Copilot, Gemini, Github copilot","Kaggle Notebooks, Colab Notebooks",laptop,"Yes, I am aware of the free resources in the DEP website.","No, I just browsed through.","Big Data Analytics PH, Community: SPARTA PH, Data Analytics Philippines, Datasense Philippines, FTW Foundation, Power Apps Pilipinas Community","Career advancement, Continued learning, Upskill / Skill acquisition, Network","Answer surveys, Coordinate during events, Co-training/ Training",_,na,_,26
"Makati, Philippines",Philippines,Male,Secondary school student,Just google,"IT, BPO, and Business Services",Professional,Work city different from residence,Wfh. Makati,,Full-time,Mostly work from home/ fully remote,Developer,Software Engineer,6 to 10,Airbyte,Google's BigQuery,Big Query,Don't know,Looker,,,,Google Cloud Platform (GCP),None,"Google sheets, Google Drive, Google Meet, Slack","Javascript, Python, SQL, Typescript, Golang",Claude,"Colab Notebooks, Databricks Collaborative Notebooks",laptop,"No, I just found out now.","No, I just browsed through.",.,"Continued learning, Decision to shift, Upskill / Skill acquisition",.,_,Toptal,Multinational employer,43
"Antipolo City, Philippines",Philippines,Male,College degree,Udemy,"IT, BPO, and Business Services",Student/ New grad/ Career Break,. ,. ,, ,. ,/,none,-,Don't know, _,NONE,., ,.,not applicable,None,not applicable,-,"Google sheets, Excel, Google Drive, OneDrive, Trello, Zoom, MS Teams, Google Meet, Slack, Discord",. ,"Chatgpt, Gemini, Perplexity","Kaggle Notebooks, Colab Notebooks",laptop,"No, I just found out now.","No, I just browsed through.",Community: SPARTA PH,"Career advancement, Continued learning, Upskill / Skill acquisition","Answer surveys, Coordinate during events, Volunteer for group initiatives",,none,Local employer,26
"Pasig, Philippines",Philippines,LGBTQ+,College degree,"IBM Skills Gateway, LinkedIn Learning",Not working,Student/ New grad/ Career Break,.,.,, _, ,.,None,na,.,none, ,.,. ,/,None,,,-,"Google sheets, Excel, Google Drive, OneDrive, Trello, Zoom, MS Teams, Google Meet, Discord","Javascript, Python","Chatgpt, Claude, Gemini, Perplexity",not applicable,laptop,"Yes, I am aware of the free resources in the DEP website.","No, I just browsed through.",.,Upskill / Skill acquisition,"Answer surveys, Connect with sponsors, Joint initiative with other groups, Co-training/ Training, Volunteer for group initiatives",,None, _,22
"Quezon City, Philippines",Philippines,Female,College degree,Not currently using any digital tools for learning,Healthcare,Student/ New grad/ Career Break,., ,,/, ,NONE,na,. ,na,.,na,/,None,-,None, ,., _,"Google sheets, Excel, Google Drive, Zoom, MS Teams, Google Meet, Discord",.,"Chatgpt, Copilot",None,laptop,"No, I just found out now.","No, I just browsed through.",,"Career advancement, Upskill / Skill acquisition",Answer surveys, _,not applicable,N.A,24
.. ,Egypt,Male,Secondary school student,Datacamp,Social Welfare and Development,Student/ New grad/ Career Break,na,-,,-,.,na,not applicable,not applicable,. , _,_,not applicable,na,NONE,_,not applicable,-, _,"Google sheets, Excel, Google Drive, Trello, Google Meet, Discord",SQL,na,Colab Notebooks,laptop,"No, I just found out now.","No, I just browsed through.",Data Science Philippines,Upskill / Skill acquisition,"Answer surveys, Lead a study group, Mentor",You can initiate more online events that are activities focused.,/,Local employer,26
"Cabuyao, Laguna, Philippines ",Philippines,Male,Secondary school student,Datacamp,Manufacturing,Student/ New grad/ Career Break,NONE,. ,,None,.,-,.,None,none,. ,None,not applicable,. , _,none,_,_,-,"Google sheets, Excel, Google Drive, OneDrive, Zoom, MS Teams, Google Meet, Discord","Javascript, Python, SQL, C","Chatgpt, Copilot, Gemini",Kaggle Notebooks,laptop,"Yes, I am aware of the free resources in the DEP website.","Yes, I have used at least one resource.","Data Analytics Philippines, Data and Analytics Manila, Data Science Philippines Discussion Group (Moderated), Philippine Data Scientists Community - eScience","Continued learning, Upskill / Skill acquisition, Network",Answer surveys,"To improve communication in Data Engineering Pilipinas, consider establishing clear and organized communication channels using platforms like Slack or Microsoft Teams, with dedicated spaces for announcements, technical discussions, and casual chats. Regular updates, such as weekly check-ins or asynchronous reporting, can ensure alignment and transparency. Implementing project management tools like Trello or Asana will help track progress and deadlines effectively. Encourage a culture of open feedback, where team members can share ideas and concerns comfortably. Finally, standardizing documentation of processes and tools will promote smoother collaboration, while analyzing communication patterns can provide insights for ongoing improvement.",None,Local employer,35
"Pampanga, Philippines",Philippines,Male,College degree,"Coursera, MicrosoftLearn, Udemy",Non-profit,Career shifter,Work city different from residence,Makati,"15,001 to 25,000",Full-time,100% onsite,Cost Engineer,Data Analyst,4 to 5,Don't know,"Pandas, Power Query",Don't know,Don't know,Power BI,Don't know,,,"Amazon Web Services (AWS), Databricks",,"Excel, MS Teams","DAX (Power BI), M language (Power Query), SQL, VBA","No, I do not use AI currently", ,laptop,"Yes, I am aware of the free resources in the DEP website.","Yes, I have used at least one resource.","Eskwelabs Data Science Aral-Aral Group, Project SPARTA","Career advancement, Decision to shift, Upskill / Skill acquisition, Network","Answer surveys, Regularly post content",. ,Online jobsite,Multinational employer,21
