"Laguna, Philippines",Philippines,Prefer not to say,PhD degree,"AWS Cloud Certification, Coursera, Datacamp, Git Hub Learning Lab, Google Cloudskills Boost, IBM Skills Gateway, LinkedIn Learning, MicrosoftLearn, Oracle University",Not working,Professional,Work city different from residence,,"15,000 and below",Other - specify,,Housekeeping,,1 - Just me,,,,,,,,,,,"Google sheets, Excel, Google Drive, OneDrive, Zoom, MS Teams, Google Meet, Discord","Python, R",Chatgpt,"Colab Notebooks, PythonAnywhere Jupyter Notebook",laptop,"No, I just found out now.","No, I just browsed through.",,Just curious ,"Answer surveys, Connect with sponsors, Coordinate during events, Joint initiative with other groups, Lead a study group, Volunteer for group initiatives",NONE,,Local employer,20
"Manila, Philippines",Philippines,Female,Other - specify,"Cisco, Coursera, Datacamp, Git Hub Learning Lab, MicrosoftLearn","IT, BPO, and Business Services",Student/ New grad/ Career Break,-,None,,not applicable,none,none,na,/,None,/,none,None,na,_, ,None,-,. ,"Google sheets, Excel, Google Drive, OneDrive, Zoom, MS Teams, Google Meet, Slack, Discord","Appscript (Google), DAX (Power BI), Python, R, SQL","Chatgpt, Copilot, Gemini, Github copilot",na,laptop,"Yes, I am aware of the free resources in the DEP website.",none,Data Analytics Philippines,"Continued learning, Decision to shift","Answer surveys, Coordinate during events, Joint initiative with other groups, Mentor, Volunteer for group initiatives",_,.,Local employer,31
"Quezon City, Philippines",Philippines,Female,,"Cisco, Codecademy, Coursera, Cybrary, Datacamp, edX, Freecodecamp, HackerRank, Khan Academy, MicrosoftLearn, W3Schools, Youtube bootcamp",Not working,Student/ New grad/ Career Break, _,none,,/,_, _,. ,.,not applicable,NONE, ,not applicable,-, _,-,. ,None,None,. ,_,. ,.,laptop,"Yes, I am aware of the free resources in the DEP website.",/,. ,"Upskill / Skill acquisition, Network",Answer surveys,NONE,NONE,Local employer,36
Antipolo,Philippines,Male,College degree,"Udemy, W3Schools","IT, BPO, and Business Services",Professional,Work city same as residence,Pasay,"45,001 to 55, 000",Full-time,Hybrid,Data Analyst,Data Engineer,6 to 10, ,Pandas,,,Power BI,,,,Microsoft Azure,"Don't know, None","Excel, Google Drive, OneDrive, MS Teams, MS planner",SQL,Chatgpt,,laptop,"No, I just found out now.","No, I just browsed through.",Project SPARTA,Upskill / Skill acquisition,Answer surveys,na,"LinkedIn, OnlineJobs.ph",Local employer,34
"Quezon City, Philippines",Philippines,Male,Other - specify,"Datacamp, Youtube bootcamp",Banking / Finance / Insurance,Student/ New grad/ Career Break,. , ,, _, ,na,not applicable,none,_,not applicable, _,na,/,none,na,/,_,-,"Excel, OneDrive, Zoom, MS Teams",SQL,"No, I do not use AI currently","Colab Notebooks, PythonAnywhere Jupyter Notebook",laptop,"Yes, I am aware of the free resources in the DEP website.","Yes, I have used at least one resource.","Data Analytics Philippines, Data Science Philippines, Data Science Philippines Discussion Group (Moderated)","Career advancement, Continued learning, Upskill / Skill acquisition",Answer surveys,NONE,na,Local employer,24
Malabon,Philippines,Female,Other - specify,Not currently using any digital tools for learning,Systems Development Internship,Student/ New grad/ Career Break,none,none,,none,_,NONE,none,None,NONE,na,-,not applicable,_,_,.,. ,-, _,"Google sheets, Google Drive, OneDrive", ,"No, I do not use AI currently",na,laptop,"Yes, I am aware of the free resources in the DEP website.","No, I just browsed through.",Java User Group Philippines,"Career advancement, Continued learning, Decision to shift, Upskill / Skill acquisition, Network","Answer surveys, Coordinate during events","Everyday posting, asking some community questions everyday or everyweek",None,Local employer,31
"Pateros, Philippines",Philippines,Male,Secondary school student,"edX, LeetCode, W3Schools, Youtube bootcamp",Not working,Student/ New grad/ Career Break,NONE,_,, ,Mostly work from home/ fully remote,none, _,-,None,not applicable,na,none,not applicable,-,None,NONE,/, _,"Google sheets, Excel, Google Drive, Zoom, MS Teams, Google Meet, Discord",Python,Chatgpt,none,laptop,"No, I just found out now.",_,Data Analytics Philippines,"Continued learning, Upskill / Skill acquisition","Answer surveys, Joint initiative with other groups, Co-training/ Training", _,/,none,20
"Pasig, Philippines",Philippines,Male,College degree,"MicrosoftLearn, Zoomcamp",Mining,Student/ New grad/ Career Break, _,. ,,., ,Studying,Studying,_,_,na,_,NONE, , _, ,/,. ,. ,"Excel, Google Drive, OneDrive, MS Teams","M language (Power Query), SQL",Chatgpt,Colab Notebooks,laptop,"No, I just found out now.","Yes, I have used at least one resource.","Community: SPARTA PH, Data Analytics Philippines, SPARTA PH: Data Engineer","Continued learning, Network","Answer surveys, Joint initiative with other groups",na,/,Local employer,45
"Pasig, Philippines",Philippines,Male,College degree,"Datacamp, Kaggle Online course, Udemy, Youtube bootcamp",Advertising,Student/ New grad/ Career Break,NONE,/,,none, , _,NONE,not applicable, _,., ,/,. ,.,. ,NONE,na,_,"Google sheets, Excel, Dropbox, Google Drive, OneDrive, MS Teams, Google Meet, Discord","Appscript (Google), DAX (Power BI), M language (Power Query), SQL, VBA","Chatgpt, Copilot, Gemini",Kaggle Notebooks,desktop,"Yes, I am aware of the free resources in the DEP website.","Yes, I have used at least one resource.","AI Design Philippines, AI Pilipinas, Analytics for Pinoys, Data Analytics Philippines, Datasense Philippines, Eskwelabs Data Science Aral-Aral Group, Power Apps Pilipinas Community, Power BI Philippines UG, PyData Philippines, Python Philippines","Career advancement, Continued learning, Upskill / Skill acquisition, Network","Answer surveys, Coordinate during events, Co-training/ Training, Volunteer for group initiatives",NONE, ,Local employer,24
Laguna Philippines,Philippines,LGBTQ+,College degree,"Freecodecamp, Youtube bootcamp",Not working,I am still new almost 3 months studying Data Science, ,Binan,"c.250,001 and above",Other - specify,Unemployed,Unemployed,Unemployed,30+,,,,,Tableau,"Don't know, None",N.A,Open Metadata,Microsoft Azure,PostgreSQL,"Google sheets, Excel, Google Drive, Slack, Discord","DAX (Power BI), M language (Power Query), Python, SQL, VBA","Chatgpt, Claude, Copilot, Gemini, Github copilot",Databricks Collaborative Notebooks,desktop,"Yes, I am aware of the free resources in the DEP website.","No, I just browsed through.",not applicable,"Career advancement, Continued learning, Decision to shift, Upskill / Skill acquisition, Network",Answer surveys,None,Unemployed,Multinational employer,27
"Paranaque, Philippines",Philippines,Male,College degree,Datacamp,Own Business/ Consultancy/Freelance,Career shifter,Work city different from residence,Paranaque City,,Freelance,Mostly work from home/ fully remote,Document Controller,Data Analyst,6 to 10,"Don't know, None","Don't know, None","Don't know, None",,"Don't know, None",Don't know,Don't know,Don't know,"Don't know, None","Splunk, Don't know","Google sheets, Excel, Slack",-,Chatgpt,No,laptop,"Yes, I am aware of the free resources in the DEP website.","Yes, I have used at least one resource.","Analytics Association of the Philippines, Data Analytics Philippines, R User Group - Philippines",Upskill / Skill acquisition,Answer surveys,none,LinkedIn,Local employer,21
Cavite,Philippines,Male,College degree,Not currently using any digital tools for learning,Telecommunication,Professional,Work city different from residence,"Benguet State University - Bokod Campus, Bukod, Benguet","25,001 to 35,000",Freelance,"Hybrid - first half at home, then usually go to the office for the latter half until I finish the rest of my shift.",Academic,Academic,2 to 3,"Don't know, Not needed in my current role","Dataform, Visual Studio, Visual Studio Code, C#",,,,"Spark, Python",Don't know,Don't know,Don't know,Oracle Database,"Google sheets, Excel, Dropbox, Google Drive, OneDrive, Zoom, MS Teams, Google Meet",.,"Chatgpt, Claude, Gemini, Groq, Perplexity",. ,laptop,"Yes, I am aware of the free resources in the DEP website.","Yes, I have used at least one resource.","Community: SPARTA PH, Data Analytics Philippines, Data Science Philippines Discussion Group (Moderated), Power BI Philippines UG","Career advancement, Continued learning","Answer surveys, Co-training/ Training",More collaboration and face-to-face meetings or seminars,My network  - people I know,Local employer,22
"San Jose del Monte, Philippines",Philippines,Male,College degree,"AWS Cloud Certification, Datacamp, W3Schools","IT, BPO, and Business Services",Professional,Work city different from residence,Pasig City,"15,000 and below",Full-time,Hybrid,Data Analyst,Data Analyst,1 - Just me,,Pandas,,,"Power BI, Tableau",ACL,Don't know,None,,,"Google sheets, Excel, Monday.com, MS Teams","Python, SQL","Chatgpt, Copilot, Gemini, Julius","PythonAnywhere Jupyter Notebook, Visual Code",laptop,"Yes, I am aware of the free resources in the DEP website.","Yes, I have used at least one resource.","Analytics Association of the Philippines, Community: SPARTA PH, Data Analytics Philippines, Data Science Manila, Datasense Philippines, Power Apps Pilipinas Community, Power BI Philippines UG, Power BI Users Meetup, PyData Philippines, Python Philippines, R User Group - Philippines","Career advancement, Continued learning, Upskill / Skill acquisition, Network","Mentor, Resource for specific topic, Co-training/ Training, Volunteer to speak in events",,"LinkedIn, My network  - people I know", _,39
"Naga city,Camarines Sur,Philippines",Philippines,Male,Other - specify,Datacamp,Agriculture,Student/ New grad/ Career Break,not applicable,na,,-,_,na,-,_,None,. ,None,/,. ,na,., , , ,"Google sheets, Excel, Google Drive, Trello, Discord",,"Chatgpt, Claude, Github copilot","Code Ocean, ",laptop,"No, I just found out now.","Yes, I have used at least one resource.","[Manila] BIG DATA Tech Group, PyData Philippines, Python Philippines",Upskill / Skill acquisition,"Answer surveys, Coordinate during events, Volunteer for group initiatives, Volunteer to speak in events",Make a AI base chatbot to answer common/usual question provide by the member.,_, ,27
"Manila, Philippines",Philippines,Female,College degree,"AWS Cloud Certification, Codecademy, SoloLearn, Udemy, W3Schools",Healthcare,Professional,Work city same as residence,Catbalogan City ,"15,000 and below",Full-time,100% onsite,Developer,Software Engineer,1 - Just me,,,,,,"None, ",,,"Amazon Web Services (AWS), Google Cloud Platform (GCP), Microsoft Azure","MongoDB, PostgreSQL, Oracle Database","Google sheets, Excel, Dropbox, Google Drive, OneDrive, Trello, Zoom, MS Teams, Google Meet, Discord",SQL,"Chatgpt, Claude, Copilot, Gemini, Github copilot",Google Cloud Vertex AI Workbench,laptop,"No, I just found out now.","No, I just browsed through.","Artificial Intelligence Philippines, DEVCON Community Group, DEVCON Philippines, PyData Philippines, Python Philippines",na,-,"To improve communication in the group, establish regular check-ins with clear agendas and use unified communication tools like Slack or Trello for organized, centralized discussions. Encourage open dialogue through regular feedback loops and anonymous feedback options to address concerns and suggestions. Additionally, ensure transparency by sharing meeting notes and making relevant documents easily accessible to all team members.","LinkedIn, Upwork",Local employer,30
"Antipolo, Philippines",Philippines,LGBTQ+,,"Coursera, Google Analytics, LinkedIn Learning, Udemy","IT, BPO, and Business Services",Professional,Work city different from residence,Mandaluyong,"35,001 to 45,000",Full-time,100% onsite,Management,"Management, Business Analyst",1 - Just me,.,Pandas,Don't know,Don't know,Power BI,,,,"Amazon Web Services (AWS), Snowflake",Don't know,"Excel, OneDrive, MS Teams",M language (Power Query),Chatgpt,. ,laptop,"Yes, I am aware of the free resources in the DEP website.","No, I just browsed through.","Data Analytics Philippines, Power Apps Pilipinas Community",Decision to shift,"Answer surveys, Co-training/ Training, Volunteer for group initiatives", ,LinkedIn,Multinational employer,28
Imus,Philippines,Male,College degree,Datacamp,Not working,Student/ New grad/ Career Break,_,na,,/,NONE,.,none, _,/,None,None,not applicable,/,none,not applicable,. ,None, ,"Google sheets, Excel, Google Drive, Zoom, MS Teams, Google Meet, Discord",SQL,"Chatgpt, Copilot",. ,laptop,"Yes, I am aware of the free resources in the DEP website.","No, I just browsed through.","Data Analytics Philippines, Datasense Philippines","Career advancement, Continued learning, Upskill / Skill acquisition, Network",Answer surveys,,not applicable,Local employer,38
"Taguig, Philippines",Philippines,Female,College degree,Not currently using any digital tools for learning,,Professional,Work city same as residence,Tacloban City,"25,001 to 35,000",Full-time,100% onsite,GIS Specialist,"Data Analyst, Academic",1 - Just me,"Don't know, None","Don't know, None","Don't know, None","Don't know, None",,"Don't know, None","Don't know, None","Don't know, None","Don't know, None","Don't know, None","Google sheets, Excel, Google Drive, Zoom, Google Meet, Discord",, _,PythonAnywhere Jupyter Notebook,laptop,"No, I just found out now.","No, I just browsed through.","Analytics Association of the Philippines, Big Data Analytics PH, Community: SPARTA PH, Data Analytics Philippines, Datasense Philippines, DevOps Philippines, Eskwelabs Data Science Aral-Aral Group, Project SPARTA","Career advancement, Continued learning, Decision to shift, Upskill / Skill acquisition, Network",Answer surveys,None,LinkedIn,,32
"Caloocan, Philippines",Philippines,Male,Other - specify,Datacamp,Not working,Student/ New grad/ Career Break,none,na,,NONE,Mostly work from home/ fully remote,None,. ,na,NONE,none,na,-,-, _,. ,not applicable,-,none,"Google sheets, Excel, Google Drive, OneDrive, Zoom, MS Teams, Google Meet, Discord","DAX (Power BI), VBA",Chatgpt,/,laptop,"No, I just found out now.","Yes, I have used at least one resource.",[Manila] BIG DATA Tech Group,"Career advancement, Continued learning, Upskill / Skill acquisition, Network",Co-training/ Training,na,NONE,Multinational employer,23
"Taguig, Philippines",Philippines,Prefer not to say,Secondary school student,"Cisco, Coursera, Freecodecamp, LinkedIn Learning, Udemy, W3Schools",Student,Career shifter, ,"Boston, MA, USA","25,001 to 35,000",Full-time,Unemployed as of the moment,Academic,Academic,1 - Just me,,,Snowflake,,"Power BI, Tableau","None, ",Internal Pyspark Library,Castor,"Amazon Web Services (AWS), Databricks",MongoDB,"Google sheets, Excel, Dropbox, Google Drive, OneDrive, Zoom, MS Teams, Google Meet, Discord","DAX (Power BI), Javascript, Python","Chatgpt, Claude, Copilot",Google Cloud Vertex AI Workbench,laptop,"No, I just found out now.","Yes, I have used at least one resource.","Data Analytics Philippines, Power BI Philippines UG","Career advancement, Network","Answer surveys, Coordinate during events, Regularly post content",Monthly webinar for members on compelling topics.,none as of the moment,Local employer,42
Bicol,Philippines,Male,College degree,Datacamp,Dating app,Professional,.,Naga City,"95,001 to 100,000",Contract fixed timeline,online,Academic,Academic,1 - Just me,_,.,_,_, _,Don't know,dbt,dbt,"Amazon Web Services (AWS), Microsoft Azure",NONE,"Excel, Zoom","DAX (Power BI), Python","No, I do not use AI currently",Kaggle Notebooks,laptop,"Yes, I am aware of the free resources in the DEP website.","Yes, I have used at least one resource.",Data Analytics Philippines,"Career advancement, Continued learning, Upskill / Skill acquisition",Co-training/ Training,,My network  - people I know,Local employer,31
las pinas,Singapore,Male,College degree,"AWS Cloud Certification, Codecademy, Cybrary, Git Hub Learning Lab, Google Developers, IBM Skills Gateway, Pluralsight, Real Python, W3Schools, Youtube bootcamp","IT, BPO, and Business Services",Student/ New grad/ Career Break,NONE,-,,. ,NONE,_,. ,na,NONE,/,NONE,_,. ,na,.,NONE,_,/,"Google sheets, Excel, Google Drive, OneDrive, MS Teams, Slack, Discord","DAX (Power BI), Javascript, Python, R, SQL, Typescript","Chatgpt, Copilot, Gemini, Amazon Q, Github copilot","Kaggle Notebooks, Amazon Sagemaker Studio, Amazon Sagemaker Studio Lab",laptop,"Yes, I am aware of the free resources in the DEP website.","Yes, I have used at least one resource.","DEVCON Community Group, DEVCON Philippines, R User Group - Philippines","Career advancement, Continued learning, Decision to shift, Upskill / Skill acquisition, Network","Answer surveys, Joint initiative with other groups, Lead a study group, Regularly post content, Co-training/ Training, Volunteer for group initiatives",Not at the moment,/,Multinational employer,24
"Manila, Philippines",Philippines,Female,PhD degree,"Google Cloudskills Boost, LinkedIn Learning, W3Schools",fintech,Professional,Work city different from residence,Davao City,"b.125,001 to 250, 000",Freelance,Mostly work from home/ fully remote,none,"Data Engineer, Data Analyst, Data Scientist, Business Analyst, Machine Learning Engineer, AI Engineer",30+,Don't know,"Pandas, Spark",not applicable,.,Looker,_,None,Don't know,Don't know,,"Google sheets, Excel, Google Drive, OneDrive, Zoom, MS Teams, Discord","Python, R, SQL","Chatgpt, Gemini",NONE,laptop,"No, I just found out now.","No, I just browsed through.","DEVCON Community Group, DEVCON Philippines, Python Philippines","Continued learning, Network","Answer surveys, Joint initiative with other groups, Co-training/ Training",,"LinkedIn, OnlineJobs.ph",International Employer,27
Cavite,Philippines,Female,College degree,"SoloLearn, W3Schools","IT, BPO, and Business Services",Student/ New grad/ Career Break,-,_,,.,. ,/,.,na,/,.,., _,.,na,not applicable,. ,/,not applicable,"Google Drive, MS Teams","Python, Typescript","Gemini, Perplexity",PythonAnywhere Jupyter Notebook,laptop,"No, I just found out now.",-,_,_,"Answer surveys, Connect with sponsors, Coordinate during events",_,-,Multinational employer,25
"Macrohon, Southern Leyte, Philippines",Philippines,Female,Secondary school student,Not currently using any digital tools for learning,Government Employee,Student/ New grad/ Career Break,None,NONE,,na,. , _,not applicable,None,None,none,.,_,na, _,/,_, _,not applicable,"Google sheets, Excel, Google Drive, Zoom, Google Meet","DAX (Power BI), Python, SQL","No, I do not use AI currently",PythonAnywhere Jupyter Notebook,workstation,"No, I just found out now.",. ,Data Science Philippines Discussion Group (Moderated),"Career advancement, Continued learning, Upskill / Skill acquisition, Network","Answer surveys, Volunteer for group initiatives",more activity,/,Local employer,24
"Quezon City, Philippines",Philippines,Male,College degree,"Datacamp, Udemy",Facility Management,Professional,Work city different from residence,Makati,"15,001 to 25,000",Full-time,100% onsite,Data Engineer,Data Engineer,6 to 10,. ,,Aws athena,na,"Power BI, Tableau", ,"Don't know, None","Don't know, None",Microsoft Azure,,"Excel, OneDrive, MS Teams",not daily basis,Chatgpt,NONE,laptop,"Yes, I am aware of the free resources in the DEP website.",. ,Project SPARTA,/,"Answer surveys, Connect with sponsors, Coordinate during events, Joint initiative with other groups",none,"LinkedIn, Indeed",US-based accounting firm,25
"Quezon City, Philippines",Philippines,Prefer not to say,Master's degree,"Google Analytics, Pluralsight, Udemy, W3Schools, Youtube bootcamp","IT, BPO, and Business Services",Professional,Work city different from residence,Mandaluyong ,"55,001 to 65,000",Full-time,Hybrid,Data Analyst,Business Analyst,4 to 5,Don't know,Don't know,Snowflake,Don't know,"Power BI, DOMO & Sigma",Don't know,Don't know,"Don't know, None","Google Cloud Platform (GCP), Microsoft Azure, Snowflake","Don't know, None","Excel, OneDrive, Monday.com, MS Teams","DAX (Power BI), M language (Power Query), SQL, VBA","Chatgpt, Copilot",Colab Notebooks,desktop,"Yes, I am aware of the free resources in the DEP website.","Yes, I have used at least one resource.",Women Who Code Manila,NONE,"Answer surveys, Connect with sponsors, Joint initiative with other groups, Lead a study group, Co-training/ Training, Volunteer for group initiatives",Small group per location like barkadahan o fraternity heheh,"My network  - people I know, Office other department ",Multinational employer,48
"Pasig, Philippines",Philippines,Male,College degree,"Datacamp, Udemy","IT, BPO, and Business Services",Career shifter,Work city different from residence,San Juan City,"35,001 to 45,000",Full-time,100% onsite,Developer,"Data Engineer, Software Engineer, Developer",1 - Just me,Databricks,"Pandas, Dask",,,Power BI,/,.,na,NONE,/,"Excel, OneDrive, MS Teams","DAX (Power BI), Python, SQL","Chatgpt, Copilot",/,laptop,"Yes, I am aware of the free resources in the DEP website.","No, I just browsed through.","Data Analytics Philippines, Datasense Philippines, Power Apps Pilipinas Community",Career advancement,Answer surveys, ,"LinkedIn, Indeed",Local employer,31
"Quezon City, Philippines",Philippines,Male,College degree,"Git Hub Learning Lab, PY4E",Not working,Student/ New grad/ Career Break,. ,/,,not applicable, _,NONE, ,-,. ,NONE,none,.,/, _,None,-,.,. ,"Google sheets, Excel, Google Drive, Zoom, MS Teams, Google Meet, Discord","Python, VBA, Matlab",Chatgpt,"Databricks Collaborative Notebooks, PythonAnywhere Jupyter Notebook",desktop,"Yes, I am aware of the free resources in the DEP website.","Yes, I have used at least one resource.","DEVCON Community Group, DEVCON Philippines","Continued learning, Upskill / Skill acquisition, Network","Answer surveys, Connect with sponsors, Joint initiative with other groups, Regularly post content, Co-training/ Training, Volunteer for group initiatives",. ,-,,28
" Catbalogan, Philippines ",Philippines,Female,Master's degree,"Codecademy, Coursera, Datacamp, Freecodecamp, Khan Academy, Udemy, W3Schools",Healthcare,Professional,Work city different from residence,Catbalogan City ,"95,001 to 100,000",Full-time,100% onsite,Developer,Software Engineer,2 to 3,,,,,,ACL,Databand,"None, Not applicable","Amazon Web Services (AWS), Google Cloud Platform (GCP), Microsoft Azure","MongoDB, PostgreSQL, Oracle Database","Google sheets, Excel, Dropbox, Google Drive, OneDrive, Trello, Zoom, MS Teams, Google Meet, Discord","Javascript, Python, SQL, Typescript","Chatgpt, Copilot, Gemini, Github copilot",not applicable,desktop,"No, I just found out now.","Yes, I have used at least one resource.","Data Analytics Philippines, DevOps Philippines, Programmers,Developers","Career advancement, Continued learning, Decision to shift, Upskill / Skill acquisition","Answer surveys, Connect with sponsors, Coordinate during events, Joint initiative with other groups, Regularly post content, Co-training/ Training, Volunteer for group initiatives, Volunteer to speak in events",NONE,"LinkedIn, Upwork", _,21
"Mandaluyong, Philippines",Philippines,Male,College degree,"Udemy, Youtube bootcamp","IT, BPO, and Business Services",Professional,Work city different from residence,Quezon City,"65,001 to 75,000",Contract fixed timeline,100% onsite,Data Engineer,"Data Engineer, Data Analyst, Software Engineer",6 to 10,"None, MS fabric",Spreadsheet,,,Power BI,,,,Google Cloud Platform (GCP),MS SQL Server,"Excel, Google Drive, OneDrive, MS Teams, Slack, Discord",,,"Kaggle Notebooks, Colab Notebooks, PythonAnywhere Jupyter Notebook",laptop,"Yes, I am aware of the free resources in the DEP website.","Yes, I have used at least one resource.",Power BI Philippines UG,"Career advancement, Continued learning, Decision to shift, Upskill / Skill acquisition",Mentor,NONE,Upwork,Taking a career break at the moment,32
"Cavite, Philippines",Philippines,Female,College degree,Not currently using any digital tools for learning,Non profit,Career shifter,Work city same as residence,Paranaque,"35,001 to 45,000",Freelance,No work as of now,Management,Software Engineer,11 to 30,Don't know,Don't know,Databricks,Don't know,Don't know, ,NONE,Unity Catalog,"Microsoft Azure, Snowflake, Databricks",Don't know,"Excel, OneDrive, Zoom, MS Teams, Google Meet, Discord","Perl, Python",Chatgpt,/,laptop,"No, I just found out now.","No, I just browsed through.", ,"Career advancement, Continued learning, Upskill / Skill acquisition","Answer surveys, Connect with sponsors, Coordinate during events, Joint initiative with other groups, Lead a study group, Mentor",.,"LinkedIn, Upwork, OnlineJobs.ph, My network  - people I know", ,34
"Paranaque, Philippines",Philippines,Male,College degree,Datacamp,"IT, BPO, and Business Services",Career shifter,Work city same as residence,Paranaque,"75,001 to 85,000",Contract fixed timeline,Mostly work from home/ fully remote,Developer,Software Engineer,11 to 30,Don't know,Don't know,Databricks,Don't know,Tableau,NONE,. ,NONE,Microsoft Azure,Don't know,"Google sheets, Excel, Google Drive, Zoom, Google Meet, Slack","DAX (Power BI), M language (Power Query), SQL",Chatgpt,Colab Notebooks,desktop,"Yes, I am aware of the free resources in the DEP website.","No, I just browsed through.","Analytics Association of the Philippines, Data Analytics Philippines, Datasense Philippines, Project SPARTA","Career advancement, Continued learning, Decision to shift, Upskill / Skill acquisition, Network","Answer surveys, Lead a study group, Mentor, Co-training/ Training, Volunteer for group initiatives",. ,"LinkedIn, Upwork, OnlineJobs.ph, My network  - people I know",None,35
