"Taguig, Philippines",Philippines,Female,College degree,Not currently using any digital tools for learning,Recruitment Firm,Career shifter,Work city different from residence,Taguig,"45,001 to 55, 000",Full-time,Mostly work from home/ fully remote,trader,Data Analyst,30+,N.A,Sql,,,Power BI,, _,,,Oracle Database,"Google sheets, Excel, Google Drive, OneDrive",Python,"Chatgpt, Claude, Gemini, Mistral","Kaggle Notebooks, PythonAnywhere Jupyter Notebook",laptop,"Yes, I am aware of the free resources in the DEP website.","Yes, I have used at least one resource.","AI Design Philippines, AI Pilipinas, Data Science Philippines","Career advancement, Continued learning, Decision to shift, Upskill / Skill acquisition",Answer surveys,. ,Haven't tried,,22
"Pasig, Philippines",Philippines,Female,Other - specify,"Freecodecamp, W3Schools, Youtube bootcamp",Not working,Student/ New grad/ Career Break, _,.,,.,_,Studying,Studying,None,. ,none,-, _,not applicable,. ,None,na,none,NONE,"Google sheets, Excel, Google Drive, OneDrive, Zoom, MS Teams, Google Meet, Discord","Javascript, SQL","Chatgpt, Gemini",Kaggle Notebooks,laptop,"No, I just found out now.","No, I just browsed through.","Datasense Philippines, Eskwelabs Data Science Aral-Aral Group",Upskill / Skill acquisition,"Answer surveys, Coordinate during events, Co-training/ Training, Volunteer for group initiatives","Establising a standard communication channels, defining the roles and responsibilities of each member during the meeting. Establish a rules and regulations for meetings that would be socially accepted, and leverage the feedback policy during and after the event.",. ,Local employer,21
"Taguig, Philippines",Philippines,Male,College degree,Datacamp,Telecommunication,Student/ New grad/ Career Break,none,none,,none,none, ,NONE,NONE, ,_,NONE,na,.,/,none,not applicable,_, ,"Google sheets, Excel, Google Drive, OneDrive, Trello, Zoom, Google Meet, Discord", _,"No, I do not use AI currently",NONE,desktop,"Yes, I am aware of the free resources in the DEP website.","Yes, I have used at least one resource.",Big Data Analytics PH,Upskill / Skill acquisition,Answer surveys,A safe place for networking and sharing recent projects is the first step if we want active engagement by the members.,na,Multinational employer,31
Muntinlupa,Philippines,Female,College degree,Not currently using any digital tools for learning,Manufacturing,Student/ New grad/ Career Break,. ,NONE,, _,/,not applicable,.,. ,not applicable, _,na,NONE,.,. ,NONE,_,. ,. ,"Google sheets, Excel, Google Drive","Python, SQL",Chatgpt,Replit,desktop,"Yes, I am aware of the free resources in the DEP website.","Yes, I have used at least one resource.","Data Science World - R & Python Free Courses, DEVCON Philippines, Java User Group Philippines, PyData Philippines, Python Philippines","Career advancement, Continued learning, Upskill / Skill acquisition, Network","Answer surveys, Joint initiative with other groups", ,not applicable,Local employer,22
Bohol,Philippines,Female,PhD degree,"Datacamp, Udemy, W3Schools, Youtube bootcamp","IT, BPO, and Business Services",Career shifter,. ,bohol,"45,001 to 55, 000",Full-time,Mostly work from home/ fully remote,Academic,Developer,1 - Just me,Don't know,Don't know,Don't know,Don't know,Don't know,Don't know,Don't know,Don't know,Don't know,Don't know,"Google sheets, Excel, Google Drive, OneDrive, Zoom, Discord","SQL, peoplecode","Chatgpt, Copilot, Gemini","Kaggle Notebooks, PythonAnywhere Jupyter Notebook",laptop,"No, I just found out now.","No, I just browsed through.","Data Analytics Philippines, PyData Philippines, Python Philippines, R User Group - Philippines","Continued learning, Upskill / Skill acquisition","Answer surveys, Joint initiative with other groups",Add an AI-generated response (faq) on social media platform,LinkedIn,.,49
"Batangas, Philippines",Philippines,Male,College degree,Datacamp,Mining,Student/ New grad/ Career Break,/,none,,/,_,na,NONE,. ,/,_, _, _,none,_,_,not applicable, _, ,"Google sheets, Excel, Dropbox, Google Drive, Zoom, MS Teams, Google Meet","Javascript, Python, SQL, C","Chatgpt, Datalab",NONE,laptop,"Yes, I am aware of the free resources in the DEP website.","Yes, I have used at least one resource.",,"Career advancement, Continued learning, Upskill / Skill acquisition, Network","Answer surveys, Connect with sponsors, Coordinate during events, Joint initiative with other groups, Co-training/ Training, Volunteer for group initiatives",Remove spam members, _,Multinational employer,39
Laguna Philippines,Philippines,Female,College degree,"Real Python, Treehouse, Udemy, W3Schools","IT, BPO, and Business Services",Professional,Work city different from residence,Quezon.City,"95,001 to 100,000",Full-time,Mostly work from home/ fully remote,Business Analyst,"Management, Data Engineer, Data Analyst, Data Scientist, Business Analyst, Developer",11 to 30,Snowflake and Alteryx,Pandas,Postgre,_,"Tableau, PBI. Quicksight, Dial pad",Postgre,,,Amazon Web Services (AWS),PostgreSQL,"Google sheets, Excel, Dropbox, Google Drive, OneDrive, Clickup, Monday.com","DAX (Power BI), Python, SQL, VBA",Amazon Q,PythonAnywhere Jupyter Notebook,laptop,"No, I just found out now.","No, I just browsed through.",AI Design Philippines,"Career advancement, Continued learning, Decision to shift, Upskill / Skill acquisition, Network","Connect with sponsors, Coordinate during events, Joint initiative with other groups, Lead a study group, Mentor, Co-training/ Training",Interactions,LinkedIn,Multinational employer,42
Rizal,Philippines,Female,Other - specify,"Coursera, Datacamp, Google Analytics",Own Business/ Consultancy/Freelance,Student/ New grad/ Career Break,not applicable,not applicable,,not applicable,-,_,not applicable,.,_,_,. ,.,None,/, ,/,.,. ,"Google sheets, Excel, Dropbox, Google Drive, OneDrive, Trello, Zoom, MS Teams, Google Meet, Slack, Discord","DAX (Power BI), M language (Power Query), Python, SQL, VBA","Chatgpt, Copilot, Gemini, Github copilot","Kaggle Notebooks, Colab Notebooks, PythonAnywhere Jupyter Notebook",laptop,"Yes, I am aware of the free resources in the DEP website.","No, I just browsed through.","AWS AI/ML, Python Philippines","Continued learning, Decision to shift, Upskill / Skill acquisition, Network",Answer surveys,More hackathons and learning sessions; projects to collaborate with, _,Multinational employer,33
"Caloocan, Philippines",Philippines,LGBTQ+,College degree,"Cisco, Datacamp, Freecodecamp, Udemy, W3Schools",Not working,Professional,Work city different from residence,Taguig,"45,001 to 55, 000",Full-time,Mostly work from home/ fully remote,Data Engineer,Data Engineer,11 to 30,Don't know,Don't know,Big Query,,,,,,,,"Google sheets, Excel, Google Drive, Zoom, MS Teams, Google Meet, Discord","Javascript, Python, SQL, VBA","Chatgpt, Gemini",Kaggle Notebooks,laptop,"Yes, I am aware of the free resources in the DEP website.","Yes, I have used at least one resource.",,Not a member. Not interested to join thr FB group,"Answer surveys, Connect with sponsors",More F2F bonding,LinkedIn,Student,24
"Paranaque, Philippines",Philippines,Male,College degree,Datacamp,Not working,Student/ New grad/ Career Break,none,None,,-,/,/,. , _,/,na,na,NONE,. ,not applicable,_,NONE, _,None,"Google sheets, Google Drive, Discord",SQL,"No, I do not use AI currently",PythonAnywhere Jupyter Notebook,laptop,"Yes, I am aware of the free resources in the DEP website.","No, I just browsed through.",_,"Career advancement, Upskill / Skill acquisition","Answer surveys, Lead a study group, Mentor, Co-training/ Training, Volunteer for group initiatives","Sharing content, or informing about AI hackathons, conventions and such", _,Multinational employer,30
"Caloocan, Philippines",Philippines,Male,College degree,"AWS Cloud Certification, Codecademy, Datacamp, Freecodecamp, Google Developers, LinkedIn Learning, Udemy, W3Schools",Not working,Student/ New grad/ Career Break,_, _,, ,/,_,None,/,/,NONE, ,na,/,/, ,. , _,NONE,"Excel, Google Drive, Zoom, MS Teams, Google Meet","Javascript, Python, SQL","Chatgpt, Gemini",PythonAnywhere Jupyter Notebook,laptop,"Yes, I am aware of the free resources in the DEP website.","Yes, I have used at least one resource.","Big Data Analytics PH, Community: SPARTA PH, Power BI Philippines UG, PyData Philippines, Python Philippines","Career advancement, Continued learning, Upskill / Skill acquisition","Answer surveys, Connect with sponsors, Lead a study group, Co-training/ Training", _, ,Local employer,22
"Manila, Philippines",Philippines,Male,College degree,"Cisco, LinkedIn Learning, Udemy","IT, BPO, and Business Services",Career shifter,Work city different from residence,Taguig City,"65,001 to 75,000",Full-time,Hybrid,Workforce Analyst,"Management, Business Analyst",2 to 3,Don't know,"Pandas, Spark",Don't know,Don't know,"Looker, Power BI, Tableau",,Don't know, ,"Amazon Web Services (AWS), Snowflake","Apache Spark, PostgreSQL","Google sheets, Excel, OneDrive, Zoom, MS Teams",-,"No, I do not use AI currently",not applicable,laptop,"No, I just found out now.","No, I just browsed through.","Data Analytics Philippines, Power BI Philippines UG, Python Philippines",. ,/,/,LinkedIn,Multinational employer,40
"Mandaluyong, Philippines",Philippines,LGBTQ+,Other - specify,"Coursera, Datacamp, edX, Freecodecamp, Google Analytics, Google Cloudskills Boost, IBM Skills Gateway, Kaggle Online course, Khan Academy, LinkedIn Learning, MicrosoftLearn, Pluralsight, Udemy","IT, BPO, and Business Services",Student/ New grad/ Career Break,not applicable,NONE,,na,/,-, ,None,na,none,not applicable,-,-,na, _,not applicable,_,-,Excel,DAX (Power BI),"Chatgpt, Claude, Copilot, Gemini", _,laptop,"No, I just found out now.","Yes, I have used at least one resource.","Data Analytics Philippines, Power BI Philippines UG","Career advancement, Continued learning, Upskill / Skill acquisition, Network, Want to help others (but still not confident)",Answer surveys,.,NONE,NOT WORKING,52
Baguio City,Philippines,Male,College degree,Datacamp,"IT, BPO, and Business Services",Career shifter,/,"BGC, Taguig City","b.125,001 to 250, 000",Internship,100% onsite,Database Operations - More on extracting data following specifications,Database Operations,1 - Just me,,,AWS Redshift,,,ACL,dbt,,"Amazon Web Services (AWS), Microsoft Azure, Snowflake, Databricks",Don't know,"Google sheets, Excel, Dropbox, Google Drive, OneDrive, Zoom, MS Teams, Google Meet, Slack, Discord",,Chatgpt,"Colab Notebooks, PythonAnywhere Jupyter Notebook",laptop,"Yes, I am aware of the free resources in the DEP website.","Yes, I have used at least one resource.","Data Analytics Philippines, Datasense Philippines","Career advancement, Continued learning, Upskill / Skill acquisition",Answer surveys, _,My network  - people I know,Multinational employer,24
"Manila, Philippines",Philippines,Male,College degree,"Datacamp, Udemy, W3Schools, Youtube bootcamp",Not working,Student/ New grad/ Career Break,NONE,. ,,_,None,_, _, ,NONE,na, _,. ,na,NONE,. ,not applicable,not applicable,na,"Google sheets, Excel, Dropbox, Google Drive, Zoom, Google Meet, Discord",Python,"Chatgpt, Copilot, Gemini",Colab Notebooks,laptop,"Yes, I am aware of the free resources in the DEP website.","No, I just browsed through.","Community: SPARTA PH, Data Analytics Philippines, Datasense Philippines, FTW Foundation, Project SPARTA, Women Who Code Manila","Continued learning, Upskill / Skill acquisition","Answer surveys, Joint initiative with other groups",. , ,Multinational employer,33
Mabalacat City,Philippines,Female,College degree,"Coursera, Datacamp",Not working,Student/ New grad/ Career Break,NONE,none,,.,. ,None, ,_,-,not applicable, ,None,none,_,. ,. , _, _,"Excel, Google Drive, Zoom, MS Teams, Google Meet, Discord","Python, SQL","Copilot, Gemini, Perplexity",.,laptop,"Yes, I am aware of the free resources in the DEP website.","Yes, I have used at least one resource.","DEVCON Philippines, PyData Philippines","Continued learning, Upskill / Skill acquisition","Answer surveys, Coordinate during events, Volunteer for group initiatives",-,.,na,33
"Manila, Philippines",Philippines,Female,College degree,"Cisco, Datacamp, Udemy, WorldQuant University Applied Data Science Lab",Retail,Career shifter,Work city same as residence,Davao City,"25,001 to 35,000",Other - specify,100% onsite,Data Analyst,"Management, Data Engineer, Data Scientist, Business Analyst, Developer, UI/UX Designer",2 to 3,Don't know,Don't know,NONE,. ,Looker,. ,_,,,,"Google sheets, Excel, Google Drive, OneDrive, Zoom, MS Teams, Discord","Python, SQL, VBA","Gemini, Datalab","PythonAnywhere Jupyter Notebook, DataCamp's Datalab",laptop,"Yes, I am aware of the free resources in the DEP website.","No, I just browsed through.","Analytics Association of the Philippines, Data Analytics Philippines, Java User Group Philippines, Power Apps Pilipinas Community","Career advancement, Continued learning, Upskill / Skill acquisition, Network","Answer surveys, Co-training/ Training",I don't have any suggestions at the moment.,My network  - people I know,Local employer,30
"Pampanga, Philippines",Philippines,Male,College degree,"Codecademy, LeetCode, MicrosoftLearn, Udemy, W3Schools, Youtube bootcamp",,Professional,Work city different from residence,Quezon City,"15,001 to 25,000",Full-time,100% onsite,Web Developer,Developer,1 - Just me,Don't know,"Pandas, None",Snowflake,,,,,,Google Cloud Platform (GCP),SQL Server,"Excel, Google Drive, OneDrive, MS Teams","DAX (Power BI), M language (Power Query), Python, SQL","Chatgpt, Copilot",Colab Notebooks,laptop,"Yes, I am aware of the free resources in the DEP website.","No, I just browsed through.","Community: SPARTA PH, Data Analytics Philippines, SPARTA PH: Data Engineer","Career advancement, Continued learning, Upskill / Skill acquisition, Network","Answer surveys, Coordinate during events, Mentor, Resource for specific topic, Volunteer for group initiatives, Volunteer to speak in events",Frequent meetups in multiple locations so that it will be accessible to more users who want to connect,LinkedIn,Multinational employer,25
Cavite,Philippines,Female,Master's degree,Not currently using any digital tools for learning,Telecommunication,Professional,Work city different from residence,Makati City,"15,001 to 25,000",Full-time,Mostly work from home/ fully remote,Business Analyst,"Data Analyst, Business Analyst",30+,/,_,.,.,,Don't know,Great Expectations,Unity Catalog,-,,"Google sheets, Excel, Dropbox, Google Drive, OneDrive, Zoom, MS Teams, Google Meet","Python, SQL","Chatgpt, Gemini",not applicable,laptop,"Yes, I am aware of the free resources in the DEP website.","Yes, I have used at least one resource.","Community: SPARTA PH, Data Analytics Philippines, Data Science Philippines Discussion Group (Moderated), Power BI Philippines UG","Career advancement, Continued learning, Decision to shift, Upskill / Skill acquisition",not applicable,. ,"LinkedIn, My network  - people I know",Local employer,27
"Paranaque, Philippines",Philippines,LGBTQ+,College degree,"HackerRank, LinkedIn Learning, Youtube bootcamp",Education,Career shifter,Work city same as residence,"Legazpi City, Albay ","a.100,001 to 125,000",Full-time,100% onsite,Business Analyst,Data Analyst,2 to 3,Don't know,Don't know,"Don't know, None","Don't know, None",Looker,"Don't know, None","Don't know, None","Don't know, None",none,/,"Google sheets, Google Drive, Discord","Python, SQL","Claude, Copilot",obsidian,laptop,"No, I just found out now.",none,"[Manila] BIG DATA Tech Group, Data Science Philippines, DevOps Philippines, Python Philippines","Career advancement, Network",Answer surveys,/,My network  - people I know,Local employer,20
Davao del Norte,Philippines,Female,College degree,"Datacamp, LinkedIn Learning, Udemy, W3Schools","IT, BPO, and Business Services",Professional,Work city same as residence,Tagum City,"25,001 to 35,000",Full-time,Mostly work from home/ fully remote,Application Support,Application Support,11 to 30,,Spark,Databricks,Don't know,Power BI,Don't know,Don't know,Don't know,Microsoft Azure,Apache Spark,"Google sheets, Excel, Google Drive, OneDrive, Trello, MS Teams",SQL,"Chatgpt, Gemini",none,laptop,"No, I just found out now.","No, I just browsed through.",,"Career advancement, Continued learning, Upskill / Skill acquisition","Answer surveys, Resource for specific topic",/,LinkedIn,Multinational employer,30
Malabon,Philippines,Male,College degree,"Datacamp, Udemy, W3Schools","IT, BPO, and Business Services",Career shifter,Work city same as residence,WFH,"b.125,001 to 250, 000",Full-time,Mostly work from home/ fully remote,Data Engineer,"Data Engineer, Data Analyst, Software Engineer, Analytics Engineer, Cloud Architect, Machine Learning Engineer, Developer",30+,Don't know,Don't know,"Databricks, Snowflake",,Power BI,Don't know,Don't know,Atlan,"Amazon Web Services (AWS), Microsoft Azure, Snowflake, Databricks",. ,"Google sheets, Excel, Google Drive, OneDrive, Zoom, MS Teams, Slack","Python, SQL","Chatgpt, Copilot, Perplexity",PythonAnywhere Jupyter Notebook,laptop,"Yes, I am aware of the free resources in the DEP website.","Yes, I have used at least one resource.","Data Analytics Philippines, Python Philippines","Career advancement, Continued learning, Upskill / Skill acquisition","Connect with sponsors, Co-training/ Training",.,LinkedIn,Local employer,39
"Madrid, Spain",Spain,Male,Master's degree,"Codecademy, Datacamp","IT, BPO, and Business Services",Career shifter,Work city same as residence,Madrid,"c.250,001 and above",Full-time,Hybrid,Workforce Analyst,"Management, Business Analyst",11 to 30,Don't know,Don't know,AWS Redshift,Airflow,Quicksight,Don't know,Don't know,Don't know,Amazon Web Services (AWS),Don't know,"Google sheets, Excel, OneDrive, Slack",SQL,Amazon Q,"Kaggle Notebooks, Colab Notebooks",laptop,"No, I just found out now.","No, I just browsed through.",/,"Career advancement, Continued learning, Upskill / Skill acquisition",Answer surveys,not applicable,Company website,Multinational employer,28
"Cebu City, Philippines",Philippines,Male,College degree,Udemy,"IT, BPO, and Business Services",Professional,Work city same as residence,WFH,"85,001 to 95,000",Full-time,Mostly work from home/ fully remote,L2 Technical Support Engineer,Data Engineer,30+,"Fivetran, Stitch",dbt,Don't know,Don't know,Tableau,Mixpanel,dbt,Castor,"Microsoft Azure, Snowflake",None,"Google sheets, Excel, MS Teams, Google Meet",not applicable,,Google Cloud Vertex AI Workbench,laptop,"Yes, I am aware of the free resources in the DEP website.",na,"Data Analytics Philippines, Power BI Philippines UG","Career advancement, Continued learning, Decision to shift, Upskill / Skill acquisition, Network",Answer surveys,.,"Indeed, Jobstreet ",Local employer,27
"Caloocan, Philippines",Philippines,Male,College degree,Udemy,"IT, BPO, and Business Services",Professional,Work city different from residence,Pasig City,"15,001 to 25,000",Full-time,Mostly work from home/ fully remote,Academic,Academic,4 to 5,,,,,Power BI,,,,Microsoft Azure,not applicable,"Google sheets, Excel, Google Drive, OneDrive, MS Teams, Slack",Appscript (Google),,NONE,desktop,"Yes, I am aware of the free resources in the DEP website.","Yes, I have used at least one resource.","Community: SPARTA PH, Data Analytics Philippines, Data Science Philippines Discussion Group (Moderated), Python Philippines","Career advancement, Continued learning, Upskill / Skill acquisition, Network","Answer surveys, Joint initiative with other groups",I generally prefer slack since it is easy to use.,Facebook,Local employer,34
"Calamba, Laguna, Philippines",Philippines,Male,Other - specify,"Datacamp, Freecodecamp, MicrosoftLearn, Udemy, W3Schools",Banking / Finance / Insurance,Student/ New grad/ Career Break,-,-,,na,_,NONE,/,None,NONE, ,NONE, , ,None,.,None,., _,"Google sheets, Excel, Google Drive, Zoom, MS Teams, Google Meet, Discord","Javascript, Python, SQL, C#","Chatgpt, Copilot, Gemini, Perplexity, Meta AI","Kaggle Notebooks, PythonAnywhere Jupyter Notebook",laptop,"Yes, I am aware of the free resources in the DEP website.","No, I just browsed through.","AI Pilipinas, Analytics Association of the Philippines, Community: SPARTA PH, Data Analytics Philippines, Data Ethics PH, Data Science Manila, DevOps Philippines, DEVCON Community Group, DEVCON Philippines, Java User Group Philippines, R User Group - Philippines, WiTech, Women Who Code Manila","Continued learning, Upskill / Skill acquisition",Answer surveys,,. ,na,23
"Rodriguez, Philippines",Philippines,Male,College degree,"Coursera, Datacamp",Unemployed,Student/ New grad/ Career Break,not applicable,.,, _,not applicable,_,-,.,NONE,none,not applicable,/,. ,NONE, _,. , ,not applicable,"Google sheets, Excel, Google Drive, Zoom, MS Teams, Google Meet, Discord","Javascript, Python, R",,PythonAnywhere Jupyter Notebook,laptop,"Yes, I am aware of the free resources in the DEP website.","Yes, I have used at least one resource.","[Manila] BIG DATA Tech Group, AI Design Philippines, AI Pilipinas, AWS AI/ML, Data Analytics Philippines, Data and Analytics Manila, Data Science Manila, Data Science Philippines, Data Science Philippines Discussion Group (Moderated), DevOps Philippines, DEVCON Community Group, DEVCON Philippines, FTW Foundation, Java User Group Philippines, Philippine Data Platform Forums, Philippine Data Scientists Community - eScience, PizzaPy - Cebu Python Users Group",_,"Answer surveys, Connect with sponsors, Coordinate during events, Joint initiative with other groups, Lead a study group, Mentor, Regularly post content, Resource for specific topic, Co-training/ Training, Volunteer for group initiatives, Volunteer to speak in events",Learning things about one another first,none,Local employer,23
Pangasinan ,Philippines,LGBTQ+,College degree,Udemy,"IT, BPO, and Business Services",Freelance,Work city same as residence,Remote,"85,001 to 95,000",Freelance,Mostly work from home/ fully remote,Data Analyst,Data Analyst,2 to 3,/,not applicable,Big Query,Don't know,,,,,Microsoft Azure,not applicable,"Google sheets, Excel, Google Drive, OneDrive, MS Teams, Slack","DAX (Power BI), M language (Power Query), VBA",Chatgpt,Colab Notebooks,laptop,"Yes, I am aware of the free resources in the DEP website.","No, I just browsed through.","AI Pilipinas, Big Data Analytics PH, Data Ethics PH, Data Science Philippines, Datasense Philippines, Eskwelabs Data Science Aral-Aral Group, FTW Foundation, Project SPARTA, Python Philippines, SPARTA PH: Data Engineer","Career advancement, Continued learning, Upskill / Skill acquisition, Network",Answer surveys,I generally prefer slack since it is easy to use.,LinkedIn,Multinational employer,26
"Pasig, Philippines",Philippines,Male,College degree,"Udemy, W3Schools, Youtube bootcamp",Not working,Student/ New grad/ Career Break,. ,not applicable,,none,. ,., _,none, _,. ,None,/,-,None,none,na,na,not applicable,"Google sheets, Excel, Google Drive, Zoom, MS Teams, Google Meet, Discord",Python,Chatgpt,PythonAnywhere Jupyter Notebook,laptop,"No, I just found out now.","Yes, I have used at least one resource.",Community: SPARTA PH,"Career advancement, Continued learning, Upskill / Skill acquisition","Answer surveys, Coordinate during events", ,/,Multinational employer,21
"san pablo city, laguna",Philippines,Female,College degree,Coursera,Not working,Student/ New grad/ Career Break,NONE,not applicable,,not applicable,/,not applicable, _,na,_,. ,not applicable,/, , , _,/, ,not applicable,"Google sheets, Excel, Google Drive, Zoom, Google Meet, Slack, Discord",Python,"No, I do not use AI currently", ,laptop,"Yes, I am aware of the free resources in the DEP website.","Yes, I have used at least one resource.",_,/,"Answer surveys, Co-training/ Training", ,NONE,Multinational employer,40
"Batangas, Philippines",Philippines,Male,College degree,Datacamp,Mining,Upskilling,None,"Harare, Zimbabwe","c.250,001 and above",Full-time,100% onsite,Geologist,"Data Analyst, Geologist",30+,,,,,,na,,,,,"Google sheets, Excel, Dropbox, Google Drive, Zoom, MS Teams, Google Meet","DAX (Power BI), M language (Power Query), Python, SQL",Chatgpt,.,laptop,"Yes, I am aware of the free resources in the DEP website.","Yes, I have used at least one resource.",. ,"Career advancement, Upskill / Skill acquisition","Answer surveys, Mentor, Co-training/ Training","Create group chat maybe, for more personal communications",LinkedIn,Multinational employer,35
"Taguig, Philippines",Philippines,Male,,"Cisco, Coursera, Freecodecamp, LinkedIn Learning, Udemy, W3Schools",Not working,Student/ New grad/ Career Break,_,/,,not applicable,. ,none, ,NONE,. ,not applicable, ,None,-,-,-, ,none, ,"Google sheets, Excel, Dropbox, Google Drive, OneDrive, Zoom, MS Teams, Google Meet, Discord","DAX (Power BI), Javascript, Python","Chatgpt, Claude, Copilot","Colab Notebooks, PythonAnywhere Jupyter Notebook",laptop,"No, I just found out now.","Yes, I have used at least one resource.","Data Science Manila, MS in Data Science - AIM Group, Philippine Data Scientists Community - eScience, Power BI Philippines UG, Power BI Users Meetup, Project SPARTA, PyData Philippines, Python Philippines, SPARTA PH: Data Engineer, Women Who Code Manila",Nonel,"Answer surveys, Coordinate during events, Regularly post content",none as of the moment,NONE,Local employer,41
"Binan City, Laguna ",Philippines,Male,,"Datacamp, Freecodecamp, Google Developers, LeetCode, MicrosoftLearn, SoloLearn, Udemy, W3Schools",Student,Student/ New grad/ Career Break,.,.,,-,NONE,none,-,NONE,. , _,.,NONE, ,/,none,/,-, ,"Google sheets, Excel, Google Drive, OneDrive, Zoom, MS Teams, Google Meet, Discord",Python,"Chatgpt, Copilot",NONE,desktop,"No, I just found out now.",na,Power BI pilipinas ,"Career advancement, Continued learning, Upskill / Skill acquisition","Answer surveys, Coordinate during events, Volunteer for group initiatives",not applicable,NONE, ,24
